{
  "schemaVersion": "1.0",
  "kind": "lesson-scoring-guide",
  "lessonId": "ma-g11-physical-education-u06-l03",
  "courseId": "ma-g11-physical-education",
  "grade": 11,
  "subject": "physical-education",
  "scoringAuthority": "RUBRIC",
  "successCriteria": [
    "The learner completes or fully describes the navigation, communication, and contingency planning task using a version their body and setting allow.",
    "The learner gives a cue, principle, tactic, or documented process rather than an unexplained result.",
    "The learner self-assesses against the stated criteria and identifies one next adjustment."
  ],
  "scoringGuidance": "Score safe participation, skill cues, tactical reasoning, self-management, and revision. Accept any version of the task the learner’s body and setting allow as full credit. Never score body size, weight, body composition, appearance, speed alone, or comparison with another person.",
  "masteryRule": "Do not mark mastery from one session. Use safe participation, skill cues, tactical decisions, self-management, personal progress against the learner’s own stated task, and self-assessment — without body-size scoring; require accurate independent evidence and successful transfer or retrieval on at least two occasions separated by time or setting.",
  "remediation": "Return to the simplest version of navigation, communication, and contingency planning — slower, smaller range, closer target, or seated — then rebuild.",
  "adaptiveRoutes": [
    {
      "signal": "prerequisite gap",
      "action": "Return to the simplest version of navigation, communication, and contingency planning — slower, smaller range, closer target, or seated — then rebuild."
    },
    {
      "signal": "procedure without understanding",
      "action": "Ask the learner to explain the cue or tactic behind navigation, communication, and contingency planning before adding intensity or complexity."
    },
    {
      "signal": "correct but low confidence",
      "action": "Confirm the specific cue that worked, offer one varied application of navigation, communication, and contingency planning, and avoid unnecessary remediation."
    },
    {
      "signal": "repeated error pattern",
      "action": "Name the observable movement pattern neutrally, contrast it with the critical features, and schedule varied practice."
    },
    {
      "signal": "pain, dizziness, breathlessness, or head impact",
      "action": "Stop immediately, tell an adult, and do not resume in this session. This is never recorded as a failed attempt."
    },
    {
      "signal": "learner declines a task",
      "action": "Offer the adapted, seated, solo, or described version of navigation, communication, and contingency planning; the alternate route is full credit and is not logged as a refusal."
    },
    {
      "signal": "mastery evidence",
      "action": "Require accurate independent performance or description plus explanation on a later occasion or in a different setting before marking navigation, communication, and contingency planning mastered."
    }
  ],
  "guardianOrParentVisibility": "Share the lesson target, completion state, evidence type, and next instructional step. Do not expose body data, fitness scores, photographs, video, recordings, or comparisons with other learners. For safety-critical units, record only the guardian confirmation that was required.",
  "guardianSafetyReview": {
    "equipment": "Weather-appropriate clothing, water, and any activity-specific safety equipment.",
    "environment": "Guardian approves the location and the plan in full before execution.",
    "movement_hazards": "Terrain, weather, heat, cold, water, traffic, and remoteness depending on the plan. Guardian approves or vetoes each element and sets the supervision arrangement.",
    "supervision_note": "Nothing in this unit is executed without explicit guardian approval of the specific plan.",
    "guardian_confirmation_required": true
  },
  "safetyAndPrivacyNotes": [
    "Use respectful, non-shaming language about bodies, ability, and effort.",
    "Allow a pause, rest, break, or alternate response mode without treating it as failure.",
    "Check space, footwear, surface, weather, and equipment before movement.",
    "Stop for pain, dizziness, breathing difficulty, head impact, or unsafe conditions and tell an adult.",
    "Score skill, strategy, self-management, consistency, and reflection — never body size, weight, weight change, body composition, appearance, or comparison with another person.",
    "Do not require weight, BMI, body-fat, body measurement, fitness-test norms, percentile ranks, calorie counts, or diet goals at any point.",
    "Do not require a photograph, video, or voice recording of the learner as evidence; described, written, and demonstrated-to-one-adult evidence is the intended route.",
    "Do not require performance in front of an audience, a group, or spectators.",
    "Route information is planning material only; the learner never records their own precise location, live tracking, or a photograph of themselves."
  ],
  "productionReadiness": {
    "status": "READY",
    "codes": [
      "READY"
    ],
    "notes": []
  }
}
