{
  "schemaVersion": "1.0",
  "kind": "lesson-scoring-guide",
  "lessonId": "ma-g8-health-u01-l04",
  "courseId": "ma-g8-health",
  "grade": 8,
  "subject": "health",
  "scoringAuthority": "RUBRIC",
  "successCriteria": [
    "The learner completes the central task about evaluating claims.",
    "The learner gives evidence, reasoning, a model, or a documented process rather than an unsupported answer.",
    "The learner checks or revises the work and can identify a next step."
  ],
  "scoringGuidance": "Score the stated learning target, accuracy, evidence/reasoning, and revision. Accept multiple valid approaches when they meet the criteria. Do not infer effort, motivation, diagnosis, or character from an error.",
  "masteryRule": "Do not mark mastery from one answer. Use scenario response, decision process, communication practice, safety plan, and private or minimally disclosive reflection; require accurate independent evidence and successful transfer or retrieval on at least two occasions when feasible.",
  "remediation": "Return to the smallest prerequisite needed for evaluating claims, model it with a concrete or text-only representation, then retry one fresh item.",
  "adaptiveRoutes": [
    {
      "signal": "prerequisite gap",
      "action": "Return to the smallest prerequisite needed for evaluating claims, model it with a concrete or text-only representation, then retry one fresh item."
    },
    {
      "signal": "procedure without understanding",
      "action": "Ask the learner to explain or represent why the process for evaluating claims works before continuing."
    },
    {
      "signal": "correct but low confidence",
      "action": "Confirm the reasoning specifically, offer one varied example of evaluating claims, and avoid unnecessary remediation."
    },
    {
      "signal": "repeated error pattern",
      "action": "Name the observable pattern neutrally, contrast it with a worked example, and schedule a short same-day or next-session review."
    },
    {
      "signal": "mastery evidence",
      "action": "Require accurate independent application plus explanation on a later or different occasion before marking evaluating claims mastered."
    }
  ],
  "guardianOrParentVisibility": "Share the lesson target, completion state, evidence type, and next instructional step. Do not expose raw private reflections, raw answers, voice recordings, or diagnosis language. For safety-critical tasks, record only the needed guardian confirmation.",
  "guardianSafetyReview": null,
  "safetyAndPrivacyNotes": [
    "Use respectful, non-shaming language.",
    "Allow a pause, break, or alternate response mode without treating it as failure.",
    "Do not require disclosure of private health, trauma, diagnosis, body, or family information.",
    "Use body-respect language; do not use dieting, calorie targets, weight cutting, weigh-ins, or body-size scoring.",
    "Direct urgent safety or health concerns to a trusted adult or qualified professional."
  ],
  "productionReadiness": {
    "status": "READY",
    "codes": [
      "READY"
    ],
    "notes": []
  }
}
