{
  "schemaVersion": "1.0",
  "kind": "lesson-scoring-guide",
  "lessonId": "ma-g9-physical-education-u02-l09",
  "courseId": "ma-g9-physical-education",
  "grade": 9,
  "subject": "physical-education",
  "scoringAuthority": "RUBRIC",
  "successCriteria": [
    "The learner holds support angles and off-object movement at activity speed against an opponent who is genuinely competing, where the decision has to be made before there is time to think it through, in whatever version their body and setting allow.",
    "The learner names what degraded first and why, rather than reporting only whether it worked.",
    "The learner compares this occasion with the earlier one and says what actually changed."
  ],
  "scoringGuidance": "Score safe participation, skill cues, tactical reasoning, self-management, and revision. Accept any version of the task the learner’s body and setting allow as full credit. Never score body size, weight, body composition, appearance, speed alone, or comparison with another person.",
  "masteryRule": "Do not mark mastery from one session. Use safe participation, skill cues, tactical decisions, self-management, personal progress against the learner’s own stated task, and self-assessment — without body-size scoring; require accurate independent evidence and successful transfer or retrieval on at least two occasions separated by time or setting.",
  "remediation": "Return to the simplest version of support angles and off-object movement — slower, smaller range, closer target, or seated — then rebuild.",
  "adaptiveRoutes": [
    {
      "signal": "prerequisite gap",
      "action": "Return to the simplest version of support angles and off-object movement — slower, smaller range, closer target, or seated — then rebuild."
    },
    {
      "signal": "procedure without understanding",
      "action": "Ask the learner to explain the cue or tactic behind support angles and off-object movement before adding intensity or complexity."
    },
    {
      "signal": "correct but low confidence",
      "action": "Confirm the specific cue that worked, offer one varied application of support angles and off-object movement, and avoid unnecessary remediation."
    },
    {
      "signal": "repeated error pattern",
      "action": "Name the observable movement pattern neutrally, contrast it with the critical features, and schedule varied practice."
    },
    {
      "signal": "pain, dizziness, breathlessness, or head impact",
      "action": "Stop immediately, tell an adult, and do not resume in this session. This is never recorded as a failed attempt."
    },
    {
      "signal": "learner declines a task",
      "action": "Offer the adapted, seated, solo, or described version of support angles and off-object movement; the alternate route is full credit and is not logged as a refusal."
    },
    {
      "signal": "transfer condition is too much today",
      "action": "Drop back to the first-pass version of support angles and off-object movement for this session and re-attempt the added demand on a later occasion. Reducing the demand is the correct response and is scored as full participation."
    },
    {
      "signal": "mastery evidence",
      "action": "Require accurate independent performance or description plus explanation on a later occasion or in a different setting before marking support angles and off-object movement mastered."
    }
  ],
  "guardianOrParentVisibility": "Share the lesson target, completion state, evidence type, and next instructional step. Do not expose body data, fitness scores, photographs, video, recordings, or comparisons with other learners. For safety-critical units, record only the guardian confirmation that was required.",
  "guardianSafetyReview": {
    "equipment": "One ball or soft substitute; improvised boundary markers.",
    "environment": "Open space clear of hazards and breakables.",
    "movement_hazards": "Running, changes of direction, and object contact. No person-to-person contact is required at any point.",
    "supervision_note": "Guardian confirms space size and whether any second participant is involved.",
    "guardian_confirmation_required": true
  },
  "safetyAndPrivacyNotes": [
    "Use respectful, non-shaming language about bodies, ability, and effort.",
    "Allow a pause, rest, break, or alternate response mode without treating it as failure.",
    "Check space, footwear, surface, weather, and equipment before movement.",
    "Stop for pain, dizziness, breathing difficulty, head impact, or unsafe conditions and tell an adult.",
    "Score skill, strategy, self-management, consistency, and reflection — never body size, weight, weight change, body composition, appearance, or comparison with another person.",
    "Do not require weight, BMI, body-fat, body measurement, fitness-test norms, percentile ranks, calorie counts, or diet goals at any point.",
    "Do not require a photograph, video, or voice recording of the learner as evidence; described, written, and demonstrated-to-one-adult evidence is the intended route.",
    "Do not require performance in front of an audience, a group, or spectators.",
    "The learner may complete the entire unit without another participant, and modifying an activity for access is itself a graded skill rather than a concession."
  ],
  "productionReadiness": {
    "status": "READY",
    "codes": [
      "READY"
    ],
    "notes": []
  }
}
